{
  "query_text": "budget review follow up",
  "top_k": 5,
  "strategy": "hybrid",
  "include_provenance": true,
  "filters": {
    "source_kinds": ["capture", "artifact"],
    "source_ids": ["cap_example_01", "art_example_01"],
    "trace_id": "trace_example_01"
  },
  "policy": {
    "lexical_weight": 0.35,
    "semantic_weight": 0.65,
    "rerank_window": 20,
    "min_combined_score": 0.15
  }
}
