{
  "query_text": "{{query_text}}",
  "top_k": 5,
  "strategy": "hybrid",
  "include_provenance": true,
  "filters": {
    "source_kinds": [],
    "source_ids": [],
    "trace_id": "{{trace_id}}"
  },
  "policy": {
    "lexical_weight": 0.4,
    "semantic_weight": 0.6,
    "rerank_window": 20,
    "min_combined_score": 0.1
  }
}
